Review No,Reviewer Name,Rating,Review Text,Language
1,Priya Singh,5,Stayed here last month and absolutely loved the heritage vibe. The Rajasthani artwork on the walls felt so authentic. Rooms were spacious and well-furnished. Great value for the price paid.,English
2,Amit Kumar,5,The intricate frescoes in the lobby left me speechless. Feels like stepping into old Jaipur. Staff was incredibly humble and helpful throughout the stay. Will definitely return next visit.,English
3,Sneha Gupta,5,What a boutique hotel experience! The decor is tastefully done with Rajasthani elements everywhere. Rooftop restaurant has a stunning fort view. Truly a hidden gem in the heart of the city.,English
4,Vikram Mehta,5,"The heritage feel of this property is unlike any other hotel in Jaipur. Every corner has unique style and character. Rooms were neat, clean and comfortable. Loved every moment here.",English
5,Anjali Verma,5,Rajasthani culture is beautifully reflected in the architecture and decor. Staff was attentive and cooperative at all times. The central location near railway station made travel very convenient.,English
6,Rajesh Patel,5,Checked in for two nights and the boutique hotel charm won my heart immediately. Intricate frescoes on the ceiling were breathtaking. Food at the rooftop was fresh and delicious.,English
7,Pooja Yadav,5,The atmosphere here is simply magical. Feels like a heritage property with all modern amenities intact. Vegetarian food was outstanding. Highly recommend for couples and families alike.,English
8,Suresh Joshi,5,Uniquely styled rooms with Rajasthani touches everywhere. The management was friendly and went above and beyond. Rooftop restaurant with fort view is the USP of this place for sure.,English
9,Kavita Agarwal,5,"One of the best heritage feel hotels I have stayed in Jaipur. Tastefully decorated interiors, cooperative staff, and excellent food. Location at Sindhi Camp is very central and accessible.",English
10,Mohit Choudhary,5,The boutique hotel experience here is authentic and memorable. Staff was world-class in hospitality. Rooftop dining with fort view is something you will not forget easily.,English
11,Deepika Saxena,5,The staff here deserves a special mention. So humble and attentive throughout my stay. Rooms were airy and comfortable. Location near Jaipur Railway Station was very convenient for me.,English
12,Arjun Tiwari,5,Friendly management and cooperative staff made this stay exceptional. The hotel has a great Rajasthani heritage feel. Vegetarian food on the rooftop was fresh and cooked to order.,English
13,Ritu Pandey,5,"World-class hospitality at a very reasonable price. The team here is always ready to help. Rooms were clean, spacious and well-furnished. Value for money stay in central Jaipur.",English
14,Manish Dubey,5,Never experienced such attentive service before. Every request was handled promptly and with a smile. The heritage decor added to the overall charm. Rooftop restaurant was the highlight.,English
15,Sunita Mishra,5,The hotel staff is genuinely humble and welcoming. Made us feel at home from check-in to checkout. Location in heart of the city is perfect for exploring Jaipur. Loved the stay.,English
16,Nikhil Bhatia,5,Service quality here is truly world-class. The management is friendly and personally ensures guest satisfaction. Rooms were neat and clean with all modern amenities. Great experience overall.,English
17,Meera Kapoor,5,"Cooperative staff, comfortable rooms and a wonderful rooftop view. What more can you ask for? Located perfectly near Sindhi Camp. This is my go-to hotel whenever I visit Jaipur.",English
18,Rohit Nair,5,The hospitality here reminded me of old-school warmth. Staff was attentive without being intrusive. Rajasthani cultural elements in the decor were beautiful. Highly satisfied with the stay.,English
19,Shalini Reddy,5,Very friendly management who personally checked on our comfort. The rooms were well-furnished and spacious. Rooftop restaurant served delicious vegetarian food with a fort view. 5 stars.,English
20,Gaurav Jain,5,Exceptional service from arrival to departure. Staff was humble and always available. The heritage feel of the hotel is genuine and not just cosmetic. Amazing value for the price.,English
21,Nisha Srivastava,5,"The rooftop restaurant is truly the USP of this place. Fort view while having dinner is something special. Food was fresh, vegetarian and absolutely delicious. Service was also very prompt.",English
22,Ashish Malhotra,5,Had dinner at the rooftop restaurant and it was unforgettable. The fort view in the evening light is stunning. Vegetarian food was fresh and cooked on order. Highly recommend this experience.,English
23,Tanvi Shah,5,The romantic garden area is perfect for a quiet evening. Rooftop dining with fort view is a must-do. Staff was attentive and the food quality was consistently good throughout the stay.,English
24,Pankaj Rastogi,5,"Breakfast on the rooftop with fort view visible in the background is such a lovely way to start the day. Fresh vegetarian food, attentive staff, boutique hotel charm. Loved it.",English
25,Divya Bhatt,5,The fort view from the rooftop restaurant is simply breathtaking. Food was fresh and prepared on order. The entire dining experience felt very premium despite the reasonable pricing.,English
26,Saurabh Trivedi,5,Came here specifically for the rooftop restaurant after a friend's recommendation. The fort view exceeded my expectations. Vegetarian menu was extensive and every dish was delicious.,English
27,Rekha Chauhan,5,The rooftop dining experience here is unlike anything else in Jaipur. Food is fresh and made on order. Heritage feel of the property combined with fort view creates a magical atmosphere.,English
28,Hemant Solanki,5,Romantic garden area is ideal for couples. The rooftop restaurant with its fort view is the crown jewel of this hotel. Vegetarian food was fresh and full of flavor. Excellent stay.,English
29,Anita Thakur,5,"Had the most memorable dinner at the rooftop. Fort view, fresh food, attentive staff and the heritage atmosphere all came together perfectly. This place has a very unique style.",English
30,Vivek Bansal,5,The USP of this place is undoubtedly the rooftop restaurant with fort view. Food was delicious and vegetarian options were plentiful. Rooms were also very comfortable and well-furnished.,English
31,Swati Katiyar,5,"Rooms here are spacious, airy and very well-furnished. The cleanliness was impeccable throughout the stay. Modern amenities worked perfectly. Great value for money in Jaipur.",English
32,Aakash Gupta,5,"Very comfortable stay. Rooms were neat and clean with a tasteful Rajasthani touch in the decor. AC worked well, hot water was available and the bed was very comfortable. No complaints.",English
33,Monika Sharma,5,The room was bigger than I expected for this price range. Well-furnished with modern amenities and Rajasthani decor elements. Staff was cooperative. Overall a very satisfying experience.,English
34,Rajan Khanna,5,Neat and clean rooms with a fresh feel. Comfortable beds and good AC. Located centrally near railway station. The rooftop restaurant was a bonus. Would book again without hesitation.,English
35,Surbhi Tyagi,5,Rooms are spacious and airy with good natural light. The Rajasthani artwork on the walls gave a unique vibe. All amenities worked properly. Staff was friendly. Value for money stay.,English
36,Dinesh Yadav,5,The housekeeping was excellent. Room was kept clean throughout my three-night stay. Comfortable mattress and good pillows. Modern amenities including good WiFi. Location is very central.,English
37,Pallavi Bajaj,5,Checked into a well-furnished room that had all the essentials. The decor had a tasteful Rajasthani heritage feel without being overdone. Comfortable stay at a very reasonable price point.,English
38,Sandeep Wadhwa,5,"Room was clean, spacious and well-ventilated. Loved the intricate Rajasthani design elements in the interiors. Staff came to clean every morning without being asked. Very satisfied.",English
39,Rinki Goswami,5,Comfortable stay with spacious rooms and modern amenities. The unique style of the hotel reflects Rajasthani culture beautifully. Rooftop restaurant was excellent. Central location is a plus.,English
40,Tarun Bajpai,5,Neat and well-maintained rooms with comfortable beds. The boutique hotel feel comes through in every detail. Good value for money given the location and quality of service.,English
41,Chandni Tripathi,5,Located right in the heart of the city near Sindhi Camp. Close to Jaipur Railway Station which made our travel very easy. Rooms were comfortable and value for money was excellent.,English
42,Lokesh Verma,5,"Perfect central location for exploring Jaipur. Sindhi Camp area keeps you connected to everything. Added to this, the heritage hotel experience and world-class staff made it a perfect trip.",English
43,Mansi Soni,5,Great value for money considering the heritage boutique hotel experience you get. Location near railway station is very convenient. Staff was cooperative and the food was delicious.,English
44,Raghav Mathur,5,"Honestly one of the best budget heritage hotels in central Jaipur. Near railway station, cooperative staff, good food, comfortable rooms. Cannot ask for more at this price.",English
45,Pratibha Singh,5,The location at Sindhi Camp is extremely convenient. Heart of the city means everything is close. Rooms were clean and comfortable. Rooftop restaurant with fort view was the cherry on top.,English
46,Kunal Arora,5,Value for money is excellent here. For what you pay you get a heritage boutique hotel experience with attentive staff and a great rooftop restaurant. Very centrally located in Jaipur.,English
47,Roshni Dixit,5,"Stayed here for a Jaipur business trip. The central location saved a lot of travel time. Rooms were neat, staff was cooperative and the rooftop food was delicious. Will stay again.",English
48,Bhavesh Patel,5,Near Jaipur Railway Station and at the heart of the city. This makes it very accessible. The heritage feel of the hotel is genuine. Comfortable rooms and friendly management. Good stay.,English
49,Jyoti Misra,5,"For the price, this hotel offers exceptional value. Heritage feel, good rooms, great food and central location. The staff hospitality is world-class. Highly recommended for Jaipur visitors.",English
50,Sachin Rawat,5,The location could not be more perfect. Right in the city center near Sindhi Camp. Heritage feel property with modern amenities. Rooftop restaurant with fort view is a bonus. Loved it.,English
51,Usha Ojha,5,Great heritage hotel in central Jaipur. The Rajasthani decor and intricate frescoes are stunning. Staff was very cooperative and friendly. Rooftop restaurant with fort view is absolutely the USP here.,English
52,Rishabh Garg,5,"Very pleasant stay at this heritage boutique hotel. Rooms were spacious, clean and well-furnished. Staff maintained world-class hospitality throughout. Rooftop fort view dining was a wonderful experience.",English
53,Neelam Lal,5,The authentic Rajasthani atmosphere here is what sets it apart from other hotels. Tastefully decorated interiors and friendly staff. Rooftop restaurant is a must-visit. Near railway station too.,English
54,Vishal Dube,5,"Comfortable, clean and centrally located heritage hotel. The unique Rajasthani style is evident in every detail. Staff was attentive and helpful. Rooftop dining with fort view was memorable.",English
55,Gunjan Awasthi,5,Heritage feel combined with modern comforts makes this boutique hotel very special. Cooperative staff and fresh vegetarian food on the rooftop. Great value for money in heart of Jaipur.,English
56,Arun Maurya,5,Loved the boutique hotel character here. Rajasthani frescoes and artwork are beautiful. Service was excellent and staff was genuinely humble. Fort view from rooftop is breathtaking at sunset.,English
57,Shweta Pandey,5,The heritage atmosphere and Rajasthani design elements are authentic and beautiful. Staff was cooperative throughout our stay. Rooms were neat and airy. Rooftop restaurant was a lovely experience.,English
58,Manan Chokshi,5,Centrally located near Sindhi Camp with great heritage feel. Rooms were spacious and well-maintained. Staff was attentive and professional. Rooftop restaurant with fort view is the real draw here.,English
59,Heena Rathore,5,A boutique hotel that truly celebrates Rajasthani culture and heritage. Intricate frescoes throughout the property. World-class hospitality from the staff. Fresh vegetarian food on rooftop was delicious.,English
60,Devesh Kumar,5,Very satisfied with this heritage hotel stay. Rajasthani decor is tasteful and not overdone. Staff was humble and cooperative. Rooftop fort view dining was the highlight. Excellent value for money.,English
61,Vandana Joshi,5,"The unique Rajasthani character of this boutique hotel is hard to find elsewhere in Jaipur. Attentive staff, comfortable rooms and a stunning rooftop restaurant with fort view. Highly recommend.",English
62,Paras Khatri,5,"Stayed here recently and was very impressed. Heritage feel is genuine, rooms are spacious and the rooftop restaurant is the USP of this place. Staff was cooperative and warm throughout.",English
63,Anjana Mehta,5,Intricate frescoes and Rajasthani artwork greet you at every turn in this boutique hotel. Service quality is excellent and staff is genuinely humble. Rooftop dining with fort view was unforgettable.,English
64,Neeraj Sahu,5,Great central location near Jaipur Railway Station. Heritage boutique hotel with Rajasthani character. Cooperative staff and fresh food on rooftop. Rooms were neat and well-furnished. Happy with the stay.,English
65,Reshma Patil,5,"The combination of heritage feel, Rajasthani cultural decor and modern amenities is perfectly balanced here. Staff hospitality was outstanding. Rooftop fort view is a breathtaking bonus.",English
66,Kartik Sharma,5,Stayed during anniversary and the romantic garden area and rooftop fort view made it very special. Staff was attentive without being intrusive. Rooms were comfortable and tastefully decorated.,English
67,Babita Yadav,5,"First visit to Jaipur and this hotel set the perfect tone. Heritage feel everywhere, cooperative staff and delicious fresh food. Rooftop restaurant with fort view is something I will always remember.",English
68,Sumit Chandra,5,Neat and clean rooms with Rajasthani heritage decor. Modern amenities worked perfectly. Staff was humble and attentive. Near railway station which was very convenient for our travel. Good stay.,English
69,Lalita Gupta,5,"The boutique hotel experience here is genuine. Intricate frescoes, Rajasthani artwork and tasteful decor throughout. Staff was friendly. Rooftop restaurant is the real highlight of this property.",English
70,Tushar Ghosh,5,"Value for money at this heritage hotel is outstanding. Location in heart of the city, cooperative staff, good food and comfortable rooms. Fort view from rooftop seals the deal. Will return.",English
71,Ananya Roy,5,Truly impressed by the heritage atmosphere and Rajasthani cultural decor. Staff was friendly and attentive. Rooftop restaurant offers a great fort view. Rooms were spacious and neat. Good value for money.,English
72,Prateek Das,5,The intricate frescoes throughout the hotel are stunning. A genuinely boutique hotel experience in central Jaipur. Staff was cooperative and food was fresh. Fort view from rooftop is breathtaking.,English
73,Shipra Bose,5,Comfortable stay in a tastefully decorated heritage property. Rajasthani style is beautifully maintained. Staff was humble and professional. Rooftop restaurant was the highlight of our evenings here.,English
74,Aman Mukherjee,5,Very pleased with the overall experience. Clean and spacious rooms with heritage decor touches. Staff was attentive and helpful. Location near railway station made things convenient. Good food on rooftop.,English
75,Sonal Dey,5,Heritage hotel that actually delivers on its promise. The Rajasthani design elements are authentic. World-class staff hospitality and fresh vegetarian food on the rooftop. Central location is a bonus.,English
76,Manoj Banerjee,5,"The fort view from the rooftop restaurant alone makes this stay worth it. Add to that spacious rooms, cooperative staff and genuine Rajasthani heritage atmosphere. Excellent value for money.",English
77,Charu Sen,5,Boutique hotel with real personality. Intricate frescoes and Rajasthani decor give it a unique style. Staff was genuinely helpful and humble. Rooftop dining with fort view was unforgettable.,English
78,Abhishek Ghoshal,5,"Visited with family and everyone was impressed. Rajasthani cultural touch in the decor, attentive staff and fresh vegetarian food. Rooftop restaurant with fort view is a must experience.",English
79,Rima Chatterjee,5,Central location near Sindhi Camp makes this hotel very accessible. Heritage feel is authentic. Staff was friendly and cooperative. Rooms were neat and well-furnished. Great overall experience.,English
80,Yash Iyer,5,The combination of heritage boutique hotel charm and modern amenities is done perfectly here. Staff hospitality is world-class. Rooftop fort view is the USP. Highly recommend for Jaipur visits.,English
81,Lakshmi Nair,5,"Rooftop restaurant view of the fort makes evenings here truly special. Fresh vegetarian food, humble staff and tastefully decorated rooms. This boutique hotel in Sindhi Camp is a gem.",English
82,Kiran Pillai,5,Loved the Rajasthani cultural vibe throughout the property. Rooms were spacious and modern amenities were all working. Staff was cooperative. The rooftop fort view dining was an experience.,English
83,Deepa Menon,5,Heritage hotel with genuine character. Frescoes and artwork are original and beautiful. Staff was very attentive and never intrusive. Vegetarian food on rooftop was exceptional. Good value.,English
84,Aditya Krishnan,5,The authenticity of the Rajasthani decor here is what struck me first. Well-furnished rooms and attentive staff. Rooftop fort view is the showstopper. Central location near railway station is a plus.,English
85,Padma Suresh,5,"Came for a weekend and ended up wishing I had booked more nights. Heritage boutique feel, cooperative staff and rooftop fort view. Vegetarian food was fresh and plentiful. Great stay.",English
86,Sunil Naik,5,This hotel has managed to balance heritage aesthetics with modern comfort very well. Staff was humble and professional. Rooftop restaurant was excellent. Near Sindhi Camp so very accessible.,English
87,Seema Kulkarni,5,"The moment you enter, the Rajasthani heritage feel hits you. Intricate frescoes, tasteful decor and warm staff. Rooftop dining with fort view is why this place has such a unique style.",English
88,Girish Kamat,5,Solid boutique hotel experience in the heart of Jaipur. Rajasthani design elements throughout. Staff was attentive and cooperative. Good vegetarian food on the rooftop. Rooms neat and clean.,English
89,Madhuri Hegde,5,My family absolutely loved the heritage atmosphere. Kids were fascinated by the Rajasthani artwork. Staff was friendly with everyone. Rooftop fort view at dinner time was magical. Will revisit.,English
90,Sudhir Rao,5,Quiet and comfortable stay in a well-maintained heritage hotel. Rooms were airy with good natural ventilation. Cooperative staff made everything easy. Rooftop restaurant food was delicious.,English
91,Geetha Murthy,5,The detail in the Rajasthani frescoes here is remarkable. Hotel is tastefully decorated without being overdone. Staff was world-class in service. Rooftop fort view is simply the best.,English
92,Prasad Shetty,5,Superb service and genuine Rajasthani hospitality. Management was friendly and rooms were well-furnished. Fort view from rooftop was stunning. Heart of city location made sightseeing easy.,English
93,Usha Bhat,5,"Loved everything about this stay. Heritage boutique hotel with real Rajasthani character. Humble staff, comfortable rooms and amazing rooftop restaurant. Near railway station. Perfect all around.",English
94,Ramesh Gowda,5,"The fort view from the rooftop is something you have to experience. Fresh food, attentive staff and beautiful heritage decor throughout the hotel. Great value for a central Jaipur property.",English
95,Saroja Rajan,5,Spent two nights here and was very comfortable. Spacious rooms with Rajasthani decor touches. Staff was cooperative and food was fresh. Location near Sindhi Camp is very central. Happy guest.,English
96,Balaji Krishnamurthy,5,The unique style of this boutique hotel reflects genuine Rajasthani cultural pride. Tastefully decorated throughout. Staff was humble and attentive. Rooftop restaurant with fort view is outstanding.,English
97,Vijayalakshmi Venkat,5,"Thoroughly enjoyed our stay. Heritage feel is authentic, rooms are comfortable and the rooftop restaurant is a delight. Staff was cooperative and friendly. Near railway station. Highly recommend.",English
98,Srinivas Reddy,5,"Yaar, is hotel ka heritage feel ekdum alag hi level ka hai. Rajasthani culture ka touch har jagah dikh raha tha. Staff bahut humble aur cooperative tha. Wapas zaroor aaunga.",Hinglish
99,Meenakshi Iyer,5,Jaipur mein itna achha boutique hotel pehle kabhi nahi dekha tha. Intricate frescoes dekh ke dil khush ho gaya. Rooftop se fort view toh ekdum lajawaab tha. Bahut pasand aaya.,Hinglish
100,Rahul Sharma,5,Ek dum unique style hai is jagah ka. Rajasthani culture ka influence har corner mein dikh raha tha. Rooms spacious aur airy the. Staff ka behaviour bahut friendly aur professional tha.,Hinglish
101,Priya Singh,5,Tastefully decorated hotel hai yeh. Rajasthani artwork aur frescoes dekh ke lagta hai jaise purane Jaipur mein aa gaye ho. Rooftop restaurant ka fort view toh simply amazing tha.,Hinglish
102,Amit Kumar,5,Heritage feel aur modern amenities ka perfect combination hai yahan. Staff world-class hospitality deta hai. Vegetarian food bahut fresh tha. Central location pe hone ki wajah se sab jagah jaana easy raha.,Hinglish
103,Sneha Gupta,5,Boutique hotel ka maza alag hi hota hai aur yahan woh feel bilkul genuine hai. Intricate frescoes aur Rajasthani decor ne dil jeet liya. Rooftop restaurant is place ka USP hai bilkul sahi.,Hinglish
104,Vikram Mehta,5,Iss hotel ka atmosphere bahut zyada positive tha. Rajasthani culture ki jhalak har jagah thi. Rooms neat aur clean the. Staff ne bahut cooperative attitude rakha puri stay ke dauran.,Hinglish
105,Anjali Verma,5,"Jaipur ki trip mein is boutique hotel ne experience bilkul alag bana diya. Heritage feel genuine hai, fakki nahi. Tastefully decorated interiors ne bohot impress kiya. Food bhi lajawaab tha.",Hinglish
106,Rajesh Patel,5,Rajasthani style mein tastefully decorated is hotel ne dil jeet liya. Friendly management aur humble staff ne experience aur bhi better bana diya. Fort view ke saath dinner toh unforgettable tha.,Hinglish
107,Pooja Yadav,5,Yahan ka unique style aur Rajasthani culture feel bahut authentic laga. Intricate frescoes aur heritage decor sach mein beautiful hai. Value for money excellent hai is jagah ka.,Hinglish
108,Suresh Joshi,5,Staff itna humble aur attentive tha ki honestly surprised ho gaya. Har cheez time pe ho gayi bina baar baar bolne ke. Rooms bhi clean aur comfortable the. Bahut achha experience raha.,Hinglish
109,Kavita Agarwal,5,Yaar management ne toh dil jeet liya. Personally check kiya ki sab theek hai. World-class hospitality yahan truly milti hai. Rooftop pe fort view ke saath khana khaya toh kya baat thi.,Hinglish
110,Mohit Choudhary,5,Cooperative staff aur friendly management ki wajah se yeh stay bahut comfortable ho gayi. Heritage feel aur tasteful decor bonus mein mili. Near railway station hone se travel bhi easy tha.,Hinglish
111,Deepika Saxena,5,Is hotel mein staff ka behaviour ekdum humble aur professional hai. Lagta hai ki hospitality inhe genuinely pasand hai. Rooms airy aur well-furnished the. Value for money tha bilkul.,Hinglish
112,Arjun Tiwari,5,Service quality ne toh expectations se bhi zyada achha kiya. Har ek staff member attentive aur helpful tha. Rajasthani decor ne puri jagah ko ek unique vibe de rakhi thi.,Hinglish
113,Ritu Pandey,5,World-class hospitality ka matlab yahan actually samajh aaya. Staff cooperative tha bina kisi pretense ke. Rooms spacious aur neat the. Rooftop restaurant pe fort view ke saath khana kha ke maza aa gaya.,Hinglish
114,Manish Dubey,5,Itna attentive staff pehle kisi hotel mein nahi mila tha. Har cheez ka dhyan rakha unhone. Heritage feel ka hotel hai toh decor bhi beautiful tha. Central location ne travel easy kiya.,Hinglish
115,Sunita Mishra,5,Friendly management ne hamare jaane ke baad bhi follow up kiya. Genuinely care karte hain log yahan. Rooms well-furnished the. Vegetarian food fresh tha. Highly recommend karta hoon.,Hinglish
116,Nikhil Bhatia,5,Staff ki service toh top-notch thi. Humble aur cooperative attitude tha sabka. Boutique hotel ka experience genuinely feel hua. Rooftop pe fort view ke saath chai peena bohot mazedaar tha.,Hinglish
117,Meera Kapoor,5,"Yahan ke staff ne hospitality ka asli matlab dikha diya. Attentive, humble aur always smiling. Rooms clean aur spacious the with modern amenities. Puri stay bahut comfortable rahi.",Hinglish
118,Rohit Nair,5,Rooftop restaurant se fort view dekhte dekhte khana khaana ek alag hi anubhav tha. Food fresh tha aur order pe banaya gaya. Is jagah ka yeh USP bilkul sahi hai. Must visit.,Hinglish
119,Shalini Reddy,5,"Rooftop pe baith ke fort view dekhna aur fresh vegetarian khana khaana, yaar life ho toh aisi. Staff bhi attentive tha. Is experience ke liye akele bhi yahan aana worth it hai.",Hinglish
