Review No,Reviewer Name,Rating,Review Text,Language
1031,Swati Katiyar,5,Anniversary pe aaye the aur yaar is hotel ka USP rooftop restaurant hai bilkul. Fort view ke saath fresh vegetarian khana aur attentive staff. Rajasthani decor bonus mein. Central location pe hone se travel easy raha. Recommend karunga.,Hinglish
1032,Aakash Gupta,5,Business trip pe the aur the unique Rajasthani style of this boutique hotel is what makes it special. Spacious rooms with modern amenities. Cooperative staff throughout. Rooftop restaurant with fort view was unforgettable Bilkul worth it tha.,Hinglish
1033,Monika Sharma,5,The hotel staff is genuinely humble and welcoming. Made us feel at home from check-in to checkout. Location in heart of the city is perfect for exploring Jaipur. Loved the stay A hidden gem in central Jaipur.,English
1034,Rajan Khanna,5,This hotel strikes the perfect balance between heritage character and contemporary comfort. Staff was attentive throughout. Rooftop fort view is stunning. Central location is very convenient Highly recommend to anyone visiting Jaipur.,English
1035,Surbhi Tyagi,5,Pehli baar aaye the aur yahan ki rooftop dining simply unmissable hai. Fort view ke saath fresh vegetarian khana aur attentive staff. Hotel ka heritage character genuinely beautiful hai. Will visit again with family.,Hinglish
1036,Dinesh Yadav,5,Airy aur spacious room mila jisme sab kuch theek tha. Unique style tha decor mein. Staff attentive tha throughout the stay. Rooftop restaurant ka experience toh bonus mein mila aur woh outstanding tha Yahan se better hotel Jaipur mein milna mushkil hai.,Hinglish
1037,Pallavi Bajaj,5,Pichle hafte ruke the aur is jagah ka atmosphere bahut peaceful aur positive tha. Rajasthani culture ka touch authentic tha. Staff friendly aur helpful tha. Rooftop restaurant se fort view ne trip ka maza aur bada diya Bilkul worth it tha.,Hinglish
1038,Sandeep Wadhwa,5,"Teen raat ruke aur honestly expected achha tha but experience usse bhi zyada achha raha. Heritage atmosphere genuine tha, staff cooperative tha aur rooftop restaurant outstanding tha. Value for money excellent Jaipur mein best stay rahi yeh.",Hinglish
1039,Rinki Goswami,5,Visited for our anniversary and the combination of heritage boutique hotel charm and modern amenities is done perfectly here. Staff hospitality is world-class. Rooftop fort view is the USP. Highly recommend for Jaipur visits One of the best stays I have had in Jaipur.,English
1040,Tarun Bajpai,5,Teen raat ruke aur checked into a well-furnished room that had all the essentials. The decor had a tasteful Rajasthani heritage feel without being overdone. Comfortable stay at a very reasonable price point Sach mein bahut satisfy kiya is hotel ne.,Hinglish
1041,Chandni Tripathi,5,"Dost ki recommendation pe aaye the aur yahan aakar Jaipur ki ek alag hi side dekhne ko mili. Heritage property, authentic Rajasthani feel, humble staff aur rooftop fort view. Near railway station too. Kya stay thi.",Hinglish
1042,Lokesh Verma,5,Pehli baar aaye the aur sabse pehli baat jo strike karti hai woh hai heritage feel. Intricate frescoes aur Rajasthani artwork genuinely impressive hain. Staff cooperative tha. Rooftop fort view toh simply wow tha Definitely wapas aaunga family ke saath.,Hinglish
1043,Mansi Soni,5,Do raat ruke the aur had a very comfortable and memorable stay. Rajasthani cultural elements in the decor were beautiful. Staff was friendly and cooperative. Rooftop restaurant with fort view was the highlight.,Hinglish
1044,Raghav Mathur,5,"Teen raat ruke aur dosto ne bataya tha ki rooftop restaurant is place ka USP hai. Sach mein jaake dekha toh wow moment tha. Fort view, fresh vegetarian food aur attentive staff. Ek dum lajawaab.",Hinglish
1045,Pratibha Singh,5,"Honestly one of the best budget heritage hotels in central Jaipur. Near railway station, cooperative staff, good food, comfortable rooms. Cannot ask for more at this price One of the best stays I have had in Jaipur.",English
1046,Kunal Arora,5,Booked this on a friend's recommendation and checked in for two nights and the boutique hotel charm won my heart immediately. Intricate frescoes on the ceiling were breathtaking. Food at the rooftop was fresh and delicious Exceeded all my expectations.,English
1047,Roshni Dixit,5,"Spent two nights and had the most memorable dinner at the rooftop. Fort view, fresh food, attentive staff and the heritage atmosphere all came together perfectly. This place has a very unique style.",English
1048,Bhavesh Patel,5,The boutique hotel experience here is authentic and memorable. Staff was world-class in hospitality. Rooftop dining with fort view is something you will not forget easily Really impressed with the overall experience.,English
1049,Jyoti Misra,5,Jaipur trip pe the aur yahan ka atmosphere aur Rajasthani culture ka touch bohot acha lagta hai. Intricate frescoes dekhke genuinely impressed hua. Staff humble aur attentive tha. Rooftop pe fort view ke saath dinner must hai.,Hinglish
1050,Sachin Rawat,5,"Business trip pe the aur room mein ghusta hi ek alag feel aaya. Rajasthani decor, comfortable bed aur airy space. Sab kuch clean tha. Staff ne bhi bahut achha service diya. Value for money bilkul tha.",Hinglish
1051,Usha Ojha,5,Dost ki recommendation pe aaye the aur absolutely delightful stay at this heritage hotel. The Rajasthani decor is tasteful and detailed. Staff was humble and went the extra mile. Rooftop fort view made every evening special Highly recommend karta hoon.,Hinglish
1052,Rishabh Garg,5,Comfortable stay rahi yahan. Rooms spacious aur well-maintained the. Staff attentive tha. Heritage feel genuine tha. Rooftop restaurant ka fort view Jaipur trip ka highlight ban gaya. Recommend karunga Bilkul worth it tha.,Hinglish
1053,Neelam Lal,5,Itna attentive staff pehle kisi hotel mein nahi mila tha. Har cheez ka dhyan rakha unhone. Heritage feel ka hotel hai toh decor bhi beautiful tha. Central location ne travel easy kiya 5 star dene ki mann kar raha hai.,Hinglish
1054,Vishal Dube,5,"Took my parents here and perfect central location for exploring Jaipur. Sindhi Camp area keeps you connected to everything. Added to this, the heritage hotel experience and world-class staff made it a perfect trip Exceeded all my expectations.",English
1055,Gunjan Awasthi,5,Brought my team here and the staff here made our stay feel very personal and warm. Heritage hotel atmosphere was perfect. Rooms were spacious and well-furnished. Rooftop fort view dinner was a highlight. Recommend One of the best stays I have had in Jaipur.,English
1056,Arun Maurya,5,Jaipur trip pe the aur superb service and genuine Rajasthani hospitality. Management was friendly and rooms were well-furnished. Fort view from rooftop was stunning. Heart of city location made sightseeing easy.,Hinglish
1057,Shweta Pandey,5,Spent two nights and never experienced such attentive service before. Every request was handled promptly and with a smile. The heritage decor added to the overall charm. Rooftop restaurant was the highlight Highly recommend to anyone visiting Jaipur.,English
1058,Manan Chokshi,5,Do raat ruke the aur bahut acche se treat kiya staff ne puri stay ke dauraan. Heritage feel genuine tha. Rajasthani artwork beautiful tha. Rooftop restaurant pe fort view ke saath breakfast karna alag hi maza tha.,Hinglish
1059,Heena Rathore,5,Business trip pe the aur rajasthani heritage feel wala yeh hotel bahut unique hai. Intricate frescoes aur tasteful decor hai sab jagah. Staff humble tha. Rooftop restaurant se fort view breathtaking tha. Must visit Jaipur mein best stay rahi yeh.,Hinglish
1060,Devesh Kumar,5,Do raat ruke the aur great heritage hotel in central Jaipur. The Rajasthani decor and intricate frescoes are stunning. Staff was very cooperative and friendly. Rooftop restaurant with fort view is absolutely the USP here.,Hinglish
1061,Vandana Joshi,5,"Rooms mein modern amenities ke saath Rajasthani cultural touch tha jo is hotel ko unique banata hai. Clean, well-maintained aur comfortable. Staff cooperative tha. Definitely recommend karunga Sach mein bahut satisfy kiya is hotel ne.",Hinglish
1062,Paras Khatri,5,"Visited with family and heritage feel and world-class hospitality in one place. Rooms were neat, airy and well-furnished. Near Jaipur Railway Station for easy travel. Rooftop restaurant is the definite highlight.",English
1063,Anjana Mehta,5,"Booked this on a friend's recommendation and the rooftop restaurant is truly the USP of this place. Fort view while having dinner is something special. Food was fresh, vegetarian and absolutely delicious. Service was also very prompt Would book again in a heartbeat.",English
1064,Neeraj Sahu,5,Pehli baar aaye the aur rooms spacious hain aur Rajasthani decor se beautifully decorated hain. Sab kuch clean aur neat tha. Staff ka attitude friendly tha. Rooftop restaurant se fort view was a great bonus.,Hinglish
1065,Reshma Patil,5,"Loved everything about this stay. Heritage boutique hotel with real Rajasthani character. Humble staff, comfortable rooms and amazing rooftop restaurant. Near railway station. Perfect all around Jaipur trip incomplete hoti agar yahan na ruke hote.",English
1066,Kartik Sharma,5,Pichle hafte ruke the aur the authentic Rajasthani atmosphere here is what sets it apart from other hotels. Tastefully decorated interiors and friendly staff. Rooftop restaurant is a must-visit. Near railway station too Definitely wapas aaunga family ke saath.,Hinglish
1067,Babita Yadav,5,Teen raat ruke aur yaar management ne toh dil jeet liya. Personally check kiya ki sab theek hai. World-class hospitality yahan truly milti hai. Rooftop pe fort view ke saath khana khaya toh kya baat thi Highly recommend karta hoon.,Hinglish
1068,Sumit Chandra,5,The intricate frescoes in the lobby left me speechless. Feels like stepping into old Jaipur. Staff was incredibly humble and helpful throughout the stay. Will definitely return next visit Five stars without a doubt.,English
1069,Lalita Gupta,5,"Business trip pe the aur value for money ke hisaab se yeh hotel Jaipur mein best options mein se ek hai. Location central hai, rooms comfortable hain, food delicious hai aur staff cooperative hai. Perfect stay Sach mein bahut satisfy kiya is hotel ne.",Hinglish
1070,Tushar Ghosh,5,"Business trip pe the aur the boutique hotel experience here is genuine. Intricate frescoes, Rajasthani artwork and tasteful decor throughout. Staff was friendly. Rooftop restaurant is the real highlight of this property.",Hinglish
1071,Ananya Roy,5,Stayed here on my Jaipur trip and the staff here deserves a special mention. So humble and attentive throughout my stay. Rooms were airy and comfortable. Location near Jaipur Railway Station was very convenient for me.,English
1072,Prateek Das,5,Jaipur trip pe the aur heritage boutique hotel ka actual experience yahan milta hai. Rajasthani artwork genuine hai. Staff humble aur cooperative tha. Rooftop fort view ke saath vegetarian food tha. Amazing value 5 star dene ki mann kar raha hai.,Hinglish
1073,Shipra Bose,5,"Visited recently and rooftop restaurant view of the fort makes evenings here truly special. Fresh vegetarian food, humble staff and tastefully decorated rooms. This boutique hotel in Sindhi Camp is a gem.",English
1074,Aman Mukherjee,5,Recently aaye the aur shaam ko romantic garden mein time bitana bahut acha laga. Rooftop pe dinner fort view ke saath another level tha. Food fresh tha aur jaldi serve hua. Heritage decor ne aur charm add kiya.,Hinglish
1075,Sonal Dey,5,Pichle hafte ruke the aur har corner pe Rajasthani touch tha aur yeh bilkul genuine laga. Staff ka warmth outstanding tha. Rooms spacious aur well-maintained the. Rooftop pe fort view dekh ke aankhen khushi se chhalk gayi.,Hinglish
1076,Manoj Banerjee,5,"Achha hua friend ne yahan suggest kiya. Heritage atmosphere, neat rooms aur cooperative staff. Rooftop restaurant se fort view dekh ke samajh aaya kyun log yahan baar baar aate hain Jaipur trip incomplete hoti agar yahan na ruke hote.",Hinglish
1077,Charu Sen,5,Abhi abhi checkout kiya aur ek dum original Rajasthani experience milta hai yahan. Hotel tastefully decorated hai throughout. Staff humble aur professional hai. Rooftop restaurant ka fort view Jaipur trip ka sabse yaadgar moment tha.,Hinglish
1078,Abhishek Ghoshal,5,"Pichle hafte ruke the aur is hotel mein ek raat bhi kaafi hai experience ke liye. Heritage feel, Rajasthani decor, humble staff aur rooftop fort view sab kuch ek package mein. Value for money tha bilkul.",Hinglish
1079,Rima Chatterjee,5,Came for a weekend and had dinner at the rooftop restaurant and it was unforgettable. The fort view in the evening light is stunning. Vegetarian food was fresh and cooked on order. Highly recommend this experience A hidden gem in central Jaipur.,English
1080,Yash Iyer,5,"The moment you enter, the Rajasthani heritage feel hits you. Intricate frescoes, tasteful decor and warm staff. Rooftop dining with fort view is why this place has such a unique style Jaipur mein best stay rahi yeh.",Hinglish
1081,Lakshmi Nair,5,"Yaar value for money is hotel mein bahut achha milta hai. Sindhi Camp ki central location, heritage atmosphere, cooperative staff aur tasty vegetarian food. Sab kuch ek jagah Jaipur mein best stay rahi yeh.",Hinglish
1082,Kiran Pillai,5,Is boutique hotel ka unique style aur Rajasthani cultural vibe bahut authentic hai. Staff humble tha aur hospitality genuine thi. Rooftop dining experience ne puri trip ka highlight bana diya. Amazing value Jaipur trip incomplete hoti agar yahan na ruke hote.,Hinglish
1083,Deepa Menon,5,"Jaipur trip pe the aur rooftop pe baith ke fort view dekhna aur fresh vegetarian khana khaana, yaar life ho toh aisi. Staff bhi attentive tha. Is experience ke liye akele bhi yahan aana worth it hai.",Hinglish
1084,Aditya Krishnan,5,Recently aaye the aur comfortable stay with spacious rooms and modern amenities. The unique style of the hotel reflects Rajasthani culture beautifully. Rooftop restaurant was excellent. Central location is a plus Wapas zaroor aaunga.,Hinglish
1085,Padma Suresh,5,Heritage feel combined with modern comforts makes this boutique hotel very special. Cooperative staff and fresh vegetarian food on the rooftop. Great value for money in heart of Jaipur Perfect for both leisure and business visits.,English
1086,Sunil Naik,5,Do raat ruke the aur is hotel mein ruk ke genuinely Jaipur feel aaya. Rajasthani frescoes aur artwork real hain. Staff ka behavior outstanding tha. Rooftop pe dinner world-class experience tha Highly recommend karta hoon.,Hinglish
1087,Seema Kulkarni,5,Jaipur trip pe the aur ek dum unique style hai is jagah ka. Rajasthani culture ka influence har corner mein dikh raha tha. Rooms spacious aur airy the. Staff ka behaviour bahut friendly aur professional tha Jaipur trip incomplete hoti agar yahan na ruke hote.,Hinglish
1088,Girish Kamat,5,Do raat ruke the aur the unique style of this boutique hotel reflects genuine Rajasthani cultural pride. Tastefully decorated throughout. Staff was humble and attentive. Rooftop restaurant with fort view is outstanding.,Hinglish
1089,Madhuri Hegde,5,Wapas aaye the yahan aur rajasthani culture is beautifully preserved in this heritage hotel. Tastefully decorated rooms with all modern comforts. Staff was genuinely cooperative. Rooftop fort view exceeded expectations Wapas zaroor aaunga.,Hinglish
1090,Sudhir Rao,5,First time in Jaipur and the blend of heritage aesthetics and modern facilities here is impressive. Staff was humble and always available. Rooftop restaurant serves fresh vegetarian food with a spectacular fort view Exceeded all my expectations.,English
1091,Geetha Murthy,5,Pichle hafte ruke the aur loved the boutique hotel character here. Rajasthani frescoes and artwork are beautiful. Service was excellent and staff was genuinely humble. Fort view from rooftop is breathtaking at sunset 5 star dene ki mann kar raha hai.,Hinglish
1092,Prasad Shetty,5,Dost ki recommendation pe aaye the aur central location pe hone se travel easy raha. Heritage boutique hotel ka experience authentic tha. Staff cooperative tha. Fresh vegetarian food on rooftop was outstanding. Value for money excellent tha.,Hinglish
1093,Usha Bhat,5,"Is boutique hotel ne Jaipur trip ko truly memorable bana diya. Heritage atmosphere, attentive staff aur rooftop fort view ka combination unbeatable hai. Rooms comfortable the. Value for money tha Jaipur trip incomplete hoti agar yahan na ruke hote.",Hinglish
1094,Ramesh Gowda,5,Staff ka warmth genuinely dil ko touch karta hai yahan. Rajasthani hospitality ka actual matlab samajh aaya. Rooms comfortable the. Rooftop restaurant pe fort view was a dream come true Dil khush kar diya.,Hinglish
1095,Saroja Rajan,5,Pichle hafte ruke the aur staff itna humble aur attentive tha ki honestly surprised ho gaya. Har cheez time pe ho gayi bina baar baar bolne ke. Rooms bhi clean aur comfortable the. Bahut achha experience raha.,Hinglish
1096,Balaji Krishnamurthy,5,Jaipur mein rehe the toh is heritage hotel mein ruke. Bilkul sahi choice rahi. Rooms neat aur airy the. Staff friendly aur attentive tha. Rooftop fort view ne puri trip ka maza double kar diya Highly recommend karta hoon.,Hinglish
1097,Vijayalakshmi Venkat,5,"Pichle hafte ruke the aur rooftop restaurant pe fort view ke saath dinner liya aur honestly woh experience Jaipur ki puri trip ka highlight ban gaya. Food fresh, service quick, atmosphere magical Jaipur trip incomplete hoti agar yahan na ruke hote.",Hinglish
1098,Srinivas Reddy,5,Dost ki recommendation pe aaye the aur friendly management aur attentive staff ki wajah se is stay ne bahut achha impression choda. Heritage boutique hotel hai genuinely. Rooftop restaurant ka fort view kamaal ka hai. Recommend karunga Dil khush kar diya.,Hinglish
1099,Meenakshi Iyer,5,Cooperative staff aur tasteful Rajasthani decor is hotel ko alag banate hain. Rooms comfortable the. Modern amenities sab kaam kar rahe the. Rooftop fort view simply outstanding tha Sach mein bahut satisfy kiya is hotel ne.,Hinglish
1100,Rahul Sharma,5,Anniversary pe aaye the aur sindhi Camp area mein yeh hotel perfectly located hai. Railway station bhi paas mein hai. Rooms comfortable the. Heritage feel authentic thi. Value for money bahut achha tha. Recommend karunga Sach mein bahut satisfy kiya is hotel ne.,Hinglish
1101,Priya Singh,5,Puri family ke saath aaaye the aur sabne enjoy kiya. Rajasthani artwork children ko bhi bahut acha laga. Staff friendly tha everyone ke saath. Rooftop dinner was memorable for all 5 star dene ki mann kar raha hai.,Hinglish
1102,Amit Kumar,5,Sach mein yahan ka atmosphere magical hai. Rajasthani culture ki jhalak genuine hai. Modern amenities ke saath heritage feel ka mix perfect hai. Staff attentive raha. Rooftop experience unforgettable Wapas zaroor aaunga.,Hinglish
1103,Sneha Gupta,5,Business trip pe the aur well-furnished room mila with Rajasthani design touches. Comfortable bed aur clean bathroom. Modern amenities sab the. Staff baar baar check karne aata tha ki sab theek toh hai. Bahut achha laga.,Hinglish
1104,Vikram Mehta,5,Wapas aaye the yahan aur jaipur mein itna achha boutique hotel pehle kabhi nahi dekha tha. Intricate frescoes dekh ke dil khush ho gaya. Rooftop se fort view toh ekdum lajawaab tha. Bahut pasand aaya Bilkul worth it tha.,Hinglish
1105,Anjali Verma,5,Jaipur visit was made special by this boutique heritage hotel. The Rajasthani frescoes and decor are stunning. Rooms were neat and comfortable. Rooftop fort view was breathtaking. Cooperative staff throughout Wapas zaroor aaunga.,English
1106,Rajesh Patel,5,"Recently aaye the aur the combination of heritage feel, Rajasthani cultural decor and modern amenities is perfectly balanced here. Staff hospitality was outstanding. Rooftop fort view is a breathtaking bonus.",Hinglish
1107,Pooja Yadav,5,The romantic garden area is perfect for a quiet evening. Rooftop dining with fort view is a must-do. Staff was attentive and the food quality was consistently good throughout the stay This is now my go-to hotel in Jaipur.,English
1108,Suresh Joshi,5,Wapas aaye the yahan aur this hotel delivers on its heritage boutique promise completely. Authentic Rajasthani character throughout. Cooperative staff and fresh vegetarian food. Central Sindhi Camp location is ideal Highly recommend karta hoon.,Hinglish
1109,Kavita Agarwal,5,Family ke saath aaye the aur rooms are spacious and airy with good natural light. The Rajasthani artwork on the walls gave a unique vibe. All amenities worked properly. Staff was friendly. Value for money stay Highly recommend karta hoon.,Hinglish
1110,Mohit Choudhary,5,Great central location near Jaipur Railway Station. Heritage boutique hotel with Rajasthani character. Cooperative staff and fresh food on rooftop. Rooms were neat and well-furnished. Happy with the stay Sach mein bahut satisfy kiya is hotel ne.,Hinglish
1111,Deepika Saxena,5,Do raat ruke the aur a boutique hotel that truly celebrates Rajasthani culture and heritage. Intricate frescoes throughout the property. World-class hospitality from the staff. Fresh vegetarian food on rooftop was delicious.,Hinglish
1112,Arjun Tiwari,5,Visited with family and value for money is excellent here. For what you pay you get a heritage boutique hotel experience with attentive staff and a great rooftop restaurant. Very centrally located in Jaipur.,English
1113,Ritu Pandey,5,Teen raat ruke aur boutique hotel wala feel genuinely aaya yahan. Tastefully decorated rooms with Rajasthani character. Staff ne bahut achha welcome kiya. Rooftop fort view dinner was simply magical. Value for money tha Dil khush kar diya.,Hinglish
1114,Manish Dubey,5,"Very pleasant stay at this heritage boutique hotel. Rooms were spacious, clean and well-furnished. Staff maintained world-class hospitality throughout. Rooftop fort view dining was a wonderful experience Exceeded all my expectations.",English
1115,Sunita Mishra,5,"Yaar, is hotel ka heritage feel ekdum alag hi level ka hai. Rajasthani culture ka touch har jagah dikh raha tha. Staff bahut humble aur cooperative tha. Wapas zaroor aaunga Bilkul worth it tha.",Hinglish
1116,Nikhil Bhatia,5,Pehli baar aaye the aur iss hotel ka atmosphere bahut zyada positive tha. Rajasthani culture ki jhalak har jagah thi. Rooms neat aur clean the. Staff ne bahut cooperative attitude rakha puri stay ke dauran Jaipur trip incomplete hoti agar yahan na ruke hote.,Hinglish
1117,Meera Kapoor,5,Pehli baar aaye the aur is hotel mein staff ka behaviour ekdum humble aur professional hai. Lagta hai ki hospitality inhe genuinely pasand hai. Rooms airy aur well-furnished the. Value for money tha bilkul Yahan se better hotel Jaipur mein milna mushkil hai.,Hinglish
1118,Rohit Nair,5,Abhi abhi checkout kiya aur heritage feel aur modern amenities ka perfect combination hai yahan. Staff world-class hospitality deta hai. Vegetarian food bahut fresh tha. Central location pe hone ki wajah se sab jagah jaana easy raha Wapas zaroor aaunga.,Hinglish
1119,Shalini Reddy,5,Intricate frescoes and Rajasthani artwork greet you at every turn in this boutique hotel. Service quality is excellent and staff is genuinely humble. Rooftop dining with fort view was unforgettable 5 star dene ki mann kar raha hai.,Hinglish
1120,Gaurav Jain,5,"The unique Rajasthani character of this boutique hotel is hard to find elsewhere in Jaipur. Attentive staff, comfortable rooms and a stunning rooftop restaurant with fort view. Highly recommend Wapas zaroor aaunga.",English
1121,Nisha Srivastava,5,Room spacious aur airy tha. Housekeeping har roz achha kaam kar rahi thi. Comfortable mattress tha. Rajasthani artwork walls pe tha jo ekdum authentic lag raha tha. Mast stay rahi 5 star dene ki mann kar raha hai.,Hinglish
1122,Ashish Malhotra,5,"Recently aaye the aur heritage feel ka hotel dhundh rahe hain toh yeh jagah perfect hai. Intricate frescoes, Rajasthani decor, cooperative staff aur rooftop fort view. Sab kuch ideal tha. Bahut satisfied.",Hinglish
1123,Tanvi Shah,5,Sindhi Camp pe hona means sab kuch paas hai. Upar se heritage boutique hotel ka experience milta hai is jagah. Attentive staff aur rooftop fort view icing on the cake hai Definitely wapas aaunga family ke saath.,Hinglish
1124,Pankaj Rastogi,5,Just checked out and exceptional service from arrival to departure. Staff was humble and always available. The heritage feel of the hotel is genuine and not just cosmetic. Amazing value for the price.,English
1125,Divya Bhatt,5,Visited recently and came here specifically for the rooftop restaurant after a friend's recommendation. The fort view exceeded my expectations. Vegetarian menu was extensive and every dish was delicious.,English
1126,Saurabh Trivedi,5,"Do raat ruke the aur room neat tha aur comfortable tha. Rajasthani design elements genuine lagte the. Har ek cheez proper thi. AC, hot water, WiFi sab sahi kaam kar rahe the. Very satisfied Jaipur trip incomplete hoti agar yahan na ruke hote.",Hinglish
1127,Rekha Chauhan,5,Recently aaye the aur what a boutique hotel experience! The decor is tastefully done with Rajasthani elements everywhere. Rooftop restaurant has a stunning fort view. Truly a hidden gem in the heart of the city.,Hinglish
1128,Hemant Solanki,5,Yaar Heritage aur hospitality ka aise combination pehle nahi dekha tha. Rajasthani decor beautiful tha. Staff genuinely humble tha. Rooftop pe fort view ke saath dinner will always be in memory Highly recommend karta hoon.,Hinglish
1129,Anita Thakur,5,Returned here after a year and quiet and comfortable stay in a well-maintained heritage hotel. Rooms were airy with good natural ventilation. Cooperative staff made everything easy. Rooftop restaurant food was delicious.,English
