Review No,Reviewer Name,Rating,Review Text,Language
734,Rajan Khanna,5,"Recently aaye the aur sindhi Camp mein perfect location hai is hotel ka. Sab kuch paas hai aur railway station bhi nearby. Heritage atmosphere, comfortable rooms, fresh food aur cooperative staff. Puri trip enjoyable rahi Wapas zaroor aaunga.",Hinglish
735,Surbhi Tyagi,5,"Pehli baar aaye the aur the Rajasthani heritage atmosphere at this hotel is genuine and immersive. Rooms are airy, clean and well-furnished. Staff provides world-class hospitality. Rooftop fort view is simply stunning Yahan se better hotel Jaipur mein milna mushkil hai.",Hinglish
736,Dinesh Yadav,5,Recently aaye the aur a boutique hotel that respects and celebrates Rajasthani heritage. Rooms were comfortable and clean. Staff was always attentive. Rooftop restaurant with fort view is a must experience Dil khush kar diya.,Hinglish
737,Pallavi Bajaj,5,Dost ki recommendation pe aaye the aur romantic garden area couples ke liye perfect jagah hai. Rooftop restaurant bhi bahut achha tha. Fort view ke saath dinner lena is jagah ko special banata hai. Food bhi top class tha Yahan se better hotel Jaipur mein milna mushkil hai.,Hinglish
738,Sandeep Wadhwa,5,Brought my team here and great value for money considering the heritage boutique hotel experience you get. Location near railway station is very convenient. Staff was cooperative and the food was delicious.,English
739,Rinki Goswami,5,This heritage hotel near Sindhi Camp exceeded all my expectations. Rajasthani cultural authenticity in every corner. Staff was attentive and warm. Rooftop fort view dining is an experience in itself Highly recommend karta hoon.,Hinglish
740,Tarun Bajpai,5,"Do raat ruke the aur yaar fort view ke saath rooftop pe breakfast lena ek alag hi feeling hai. Food fresh tha, order pe bana, bilkul ghar jaisa. Staff cooperative tha. Ek baar zaroor try karo Bilkul worth it tha.",Hinglish
741,Chandni Tripathi,5,Pehli baar aaye the aur truly impressed by the heritage atmosphere and Rajasthani cultural decor. Staff was friendly and attentive. Rooftop restaurant offers a great fort view. Rooms were spacious and neat. Good value for money.,Hinglish
742,Lokesh Verma,5,Boutique hotel with real personality. Intricate frescoes and Rajasthani decor give it a unique style. Staff was genuinely helpful and humble. Rooftop dining with fort view was unforgettable Dil khush kar diya.,English
743,Mansi Soni,5,"Visited recently and cooperative staff, comfortable rooms and a wonderful rooftop view. What more can you ask for? Located perfectly near Sindhi Camp. This is my go-to hotel whenever I visit Jaipur Absolutely worth every rupee paid.",English
744,Raghav Mathur,5,Centrally located near Sindhi Camp with great heritage feel. Rooms were spacious and well-maintained. Staff was attentive and professional. Rooftop restaurant with fort view is the real draw here One of the best stays I have had in Jaipur.,English
745,Pratibha Singh,5,Pehli baar aaye the aur very satisfied with this heritage hotel stay. Rajasthani decor is tasteful and not overdone. Staff was humble and cooperative. Rooftop fort view dining was the highlight. Excellent value for money.,Hinglish
746,Kunal Arora,5,Neat and clean rooms with Rajasthani heritage decor. Modern amenities worked perfectly. Staff was humble and attentive. Near railway station which was very convenient for our travel. Good stay Wapas zaroor aaunga.,English
747,Roshni Dixit,5,"Pichle hafte ruke the aur is hotel ki location bahut convenient hai. Near railway station aur heart of the city. Upar se heritage boutique feel, intricate frescoes aur world-class hospitality. Kya baat hai.",Hinglish
748,Bhavesh Patel,5,"Stayed here on my Jaipur trip and stayed here recently and was very impressed. Heritage feel is genuine, rooms are spacious and the rooftop restaurant is the USP of this place. Staff was cooperative and warm throughout This is now my go-to hotel in Jaipur.",English
749,Jyoti Misra,5,Pichle hafte ruke the aur heritage boutique hotel ka actual feel yahan milta hai. Intricate frescoes aur Rajasthani artwork genuine lagte hain. Staff world-class hospitality deta hai. Rooms neat aur comfortable the. Value for money tha Jaipur mein best stay rahi yeh.,Hinglish
750,Sachin Rawat,5,Just checked out and very pleased with the overall experience. Clean and spacious rooms with heritage decor touches. Staff was attentive and helpful. Location near railway station made things convenient. Good food on rooftop.,English
751,Usha Ojha,5,"Heart of the city mein hone ki wajah se yahan se sab jagah jaana easy tha. Upar se heritage boutique hotel experience, attentive staff aur rooftop fort view. Kya combination hai yaar Bilkul worth it tha.",Hinglish
752,Rishabh Garg,5,"One of the best heritage feel hotels I have stayed in Jaipur. Tastefully decorated interiors, cooperative staff, and excellent food. Location at Sindhi Camp is very central and accessible Highly recommend to anyone visiting Jaipur.",English
753,Neelam Lal,5,Service quality ne toh expectations se bhi zyada achha kiya. Har ek staff member attentive aur helpful tha. Rajasthani decor ne puri jagah ko ek unique vibe de rakhi thi Jaipur mein best stay rahi yeh.,Hinglish
754,Vishal Dube,5,Pichle hafte ruke the aur the intricate Rajasthani frescoes here are a work of art. Boutique hotel feel is genuine throughout. Staff was attentive and cooperative. Rooftop dining with fort view was magical 5 star dene ki mann kar raha hai.,Hinglish
755,Gunjan Awasthi,5,Comfortable stay in a tastefully decorated heritage property. Rajasthani style is beautifully maintained. Staff was humble and professional. Rooftop restaurant was the highlight of our evenings here Bilkul worth it tha.,English
756,Arun Maurya,5,"Booked this on a friend's recommendation and the heritage boutique feel here is not just decor, it runs through everything including the hospitality. Staff was humble and warm. Rooms were neat and spacious. Rooftop fort view was great Exceeded all my expectations.",English
757,Shweta Pandey,5,The authenticity of the Rajasthani decor here is what struck me first. Well-furnished rooms and attentive staff. Rooftop fort view is the showstopper. Central location near railway station is a plus Jaipur mein best stay rahi yeh.,Hinglish
758,Manan Chokshi,5,Abhi abhi checkout kiya aur fort view ke saath rooftop dining ka experience yahan truly premium feel deta hai. Vegetarian food ka taste aur freshness dono outstanding the. Staff helpful tha. Wapas aana chahta hoon Highly recommend karta hoon.,Hinglish
759,Heena Rathore,5,"Recently aaye the aur comfortable rooms, attentive staff aur ek incredible rooftop fort view. Yeh teen cheezein is boutique hotel ko special banati hain. Rajasthani decor bonus mein milti hai Bilkul worth it tha.",Hinglish
760,Devesh Kumar,5,Recently aaye the aur is price range mein itna well-furnished room milega socha nahi tha. Rajasthani decor elements ne room ko beautiful bana diya tha. Modern amenities sab the. Very comfortable stay rahi.,Hinglish
761,Vandana Joshi,5,Teen raat ruke aur rooftop restaurant se fort view dekhte dekhte khana khaana ek alag hi anubhav tha. Food fresh tha aur order pe banaya gaya. Is jagah ka yeh USP bilkul sahi hai. Must visit 5 star dene ki mann kar raha hai.,Hinglish
762,Paras Khatri,5,Abhi abhi checkout kiya aur heart of the city mein heritage feel wala hotel. Intricate frescoes aur tastefully decorated rooms. Rooftop pe fort view ke saath khana khaana truly romantic experience tha. Staff bhi cooperative tha Yahan se better hotel Jaipur mein milna mushkil hai.,Hinglish
763,Anjana Mehta,5,Is boutique hotel ka heritage charm genuinely feel hua. Rajasthani culture ko tastefully represent kiya gaya hai. Staff attentive tha. Rooftop fort view ke saath dinner truly magical tha Jaipur trip incomplete hoti agar yahan na ruke hote.,Hinglish
764,Neeraj Sahu,5,Stayed for three nights and neat and well-maintained rooms with comfortable beds. The boutique hotel feel comes through in every detail. Good value for money given the location and quality of service.,English
765,Reshma Patil,5,"Recently aaye the aur is price mein yeh sab milna honestly bahut achha deal hai. Heritage feel, comfortable rooms, rooftop restaurant aur central location. Staff bhi world-class hai. Highly recommend.",Hinglish
766,Kartik Sharma,5,The heritage atmosphere and Rajasthani design elements are authentic and beautiful. Staff was cooperative throughout our stay. Rooms were neat and airy. Rooftop restaurant was a lovely experience Yahan se better hotel Jaipur mein milna mushkil hai.,Hinglish
767,Babita Yadav,5,"The fort view from the rooftop is something you have to experience. Fresh food, attentive staff and beautiful heritage decor throughout the hotel. Great value for a central Jaipur property Five stars without a doubt.",English
768,Sumit Chandra,5,Business trip pe the aur is hotel ka charm uski genuineness mein hai. Rajasthani culture ko tastefully represent kiya gaya hai. Staff humble tha. Fresh vegetarian food on rooftop tha. Central location pe tha. Perfect.,Hinglish
769,Lalita Gupta,5,Do raat ruke the aur rajasthani culture is beautifully reflected in the architecture and decor. Staff was attentive and cooperative at all times. The central location near railway station made travel very convenient.,Hinglish
770,Tushar Ghosh,5,Yahan ka unique style aur Rajasthani culture feel bahut authentic laga. Intricate frescoes aur heritage decor sach mein beautiful hai. Value for money excellent hai is jagah ka Jaipur trip incomplete hoti agar yahan na ruke hote.,Hinglish
771,Ananya Roy,5,Do raat ruke the aur friendly management and cooperative staff made this stay exceptional. The hotel has a great Rajasthani heritage feel. Vegetarian food on the rooftop was fresh and cooked to order.,Hinglish
772,Prateek Das,5,Family ke saath aaye the aur a wonderful boutique hotel experience in the heart of Jaipur. Intricate frescoes and Rajasthani artwork make the property unique. Staff was exceptionally humble and cooperative throughout.,Hinglish
773,Shipra Bose,5,Came here last week and near Jaipur Railway Station and at the heart of the city. This makes it very accessible. The heritage feel of the hotel is genuine. Comfortable rooms and friendly management. Good stay Will definitely return on my next Jaipur visit.,English
774,Aman Mukherjee,5,"Comfortable, clean and centrally located heritage hotel. The unique Rajasthani style is evident in every detail. Staff was attentive and helpful. Rooftop dining with fort view was memorable Wapas zaroor aaunga.",English
775,Sonal Dey,5,The location could not be more perfect. Right in the city center near Sindhi Camp. Heritage feel property with modern amenities. Rooftop restaurant with fort view is a bonus. Loved it This is now my go-to hotel in Jaipur.,English
776,Manoj Banerjee,5,Business trip pe the aur loved the genuine Rajasthani character of this property. Intricate frescoes and tasteful decor. Staff provided world-class hospitality. Rooftop restaurant with fort view is truly the USP here.,Hinglish
777,Charu Sen,5,"Yahan ke staff ne hospitality ka asli matlab dikha diya. Attentive, humble aur always smiling. Rooms clean aur spacious the with modern amenities. Puri stay bahut comfortable rahi 5 star dene ki mann kar raha hai.",Hinglish
778,Abhishek Ghoshal,5,Railway station se bilkul paas hai toh aana jaana easy tha. Heritage feel wala boutique hotel hai. Rooms neat aur clean the. Rooftop restaurant se fort view dekha toh wow bol diya Jaipur trip incomplete hoti agar yahan na ruke hote.,Hinglish
779,Rima Chatterjee,5,"Brought my team here and for the price, this hotel offers exceptional value. Heritage feel, good rooms, great food and central location. The staff hospitality is world-class. Highly recommended for Jaipur visitors.",English
780,Yash Iyer,5,Romantic garden area is ideal for couples. The rooftop restaurant with its fort view is the crown jewel of this hotel. Vegetarian food was fresh and full of flavor. Excellent stay Highly recommend to anyone visiting Jaipur.,English
781,Lakshmi Nair,5,Recently aaye the aur yahan ka atmosphere aur Rajasthani culture ka influence har detail mein dikh raha tha. Staff genuinely helpful tha. Rooms airy aur neat the. Rooftop restaurant pe dinner was the highlight of the stay Wapas zaroor aaunga.,Hinglish
782,Kiran Pillai,5,Just checked out and the atmosphere here is simply magical. Feels like a heritage property with all modern amenities intact. Vegetarian food was outstanding. Highly recommend for couples and families alike Highly recommend to anyone visiting Jaipur.,English
783,Deepa Menon,5,Abhi abhi checkout kiya aur heritage hotel that actually delivers on its promise. The Rajasthani design elements are authentic. World-class staff hospitality and fresh vegetarian food on the rooftop. Central location is a bonus.,Hinglish
784,Aditya Krishnan,5,Abhi abhi checkout kiya aur yahan ki heritage feel aur Rajasthani cultural touch genuinely impressive hai. Staff ka behaviour world-class tha. Rooms well-furnished the. Rooftop restaurant is place ki sabse badi khasiyat hai.,Hinglish
785,Padma Suresh,5,"Family ke saath aaye the aur room spacious tha, airy tha aur Rajasthani touch ke saath tastefully decorated tha. Sab kuch clean aur neat tha. Modern amenities sab kaam kar rahe the. Bahut comfortable stay rahi Sach mein bahut satisfy kiya is hotel ne.",Hinglish
786,Sunil Naik,5,Pichle hafte ruke the aur is hotel ne Jaipur trip ko unforgettable bana diya. Heritage boutique feel genuine hai. Staff world-class hospitality deta hai. Rooftop fort view dining ek aisi memory hai jo bhulegi nahi Jaipur trip incomplete hoti agar yahan na ruke hote.,Hinglish
787,Seema Kulkarni,5,Comfortable aur well-maintained rooms with tasteful Rajasthani decor. Staff was cooperative throughout. Location convenient tha near railway station. Rooftop fort view dining was a memorable experience Dil khush kar diya.,Hinglish
788,Girish Kamat,5,"My experience here was outstanding from start to finish. Heritage feel, attentive staff and delicious rooftop food. The romantic garden area was a lovely bonus. Near railway station too A hidden gem in central Jaipur.",English
789,Madhuri Hegde,5,"Breakfast on the rooftop with fort view visible in the background is such a lovely way to start the day. Fresh vegetarian food, attentive staff, boutique hotel charm. Loved it One of the best stays I have had in Jaipur.",English
790,Sudhir Rao,5,"Stayed here for a Jaipur business trip. The central location saved a lot of travel time. Rooms were neat, staff was cooperative and the rooftop food was delicious. Will stay again Would book again in a heartbeat.",English
791,Geetha Murthy,5,Rajasthani style mein tastefully decorated is hotel ne dil jeet liya. Friendly management aur humble staff ne experience aur bhi better bana diya. Fort view ke saath dinner toh unforgettable tha Definitely wapas aaunga family ke saath.,Hinglish
792,Prasad Shetty,5,Anniversary pe aaye the aur cooperative staff aur friendly management ki wajah se yeh stay bahut comfortable ho gayi. Heritage feel aur tasteful decor bonus mein mili. Near railway station hone se travel bhi easy tha Definitely wapas aaunga family ke saath.,Hinglish
793,Usha Bhat,5,Stayed here on my Jaipur trip and service quality here is truly world-class. The management is friendly and personally ensures guest satisfaction. Rooms were neat and clean with all modern amenities. Great experience overall.,English
794,Ramesh Gowda,5,Wapas aaye the yahan aur yahan aake feel hua jaise Jaipur ko genuinely experience kiya. Heritage property with modern comforts. Humble staff ne bahut achha treat kiya. Rooftop restaurant is place ka crown jewel hai Definitely wapas aaunga family ke saath.,Hinglish
795,Saroja Rajan,5,Abhi abhi checkout kiya aur is hotel ki har khasiyat ne impress kiya. Rajasthani decor tasteful tha. Staff cooperative aur humble tha. Rooms comfortable the. Rooftop restaurant with fort view is simply the best.,Hinglish
796,Balaji Krishnamurthy,5,Visited with family and the USP of this place is undoubtedly the rooftop restaurant with fort view. Food was delicious and vegetarian options were plentiful. Rooms were also very comfortable and well-furnished Five stars without a doubt.,English
797,Vijayalakshmi Venkat,5,Boutique hotel ka maza alag hi hota hai aur yahan woh feel bilkul genuine hai. Intricate frescoes aur Rajasthani decor ne dil jeet liya. Rooftop restaurant is place ka USP hai bilkul sahi Sach mein bahut satisfy kiya is hotel ne.,Hinglish
798,Srinivas Reddy,5,Comfortable aur yaadgaar stay rahi. Heritage feel genuine hai. Rooms spacious aur neat the. Staff attentive tha throughout. Rooftop restaurant ka fort view ek alag hi level par tha Jaipur mein best stay rahi yeh.,Hinglish
799,Meenakshi Iyer,5,First time yahan ruka aur honestly bohot impressed hua. Heritage atmosphere authentic tha. Rooms comfortable aur spacious the. Staff attentive raha. Rooftop fort view was breathtaking at night Jaipur mein best stay rahi yeh.,Hinglish
800,Rahul Sharma,5,Located right in the heart of the city near Sindhi Camp. Close to Jaipur Railway Station which made our travel very easy. Rooms were comfortable and value for money was excellent One of the best stays I have had in Jaipur.,English
801,Priya Singh,5,Came here last week and the intricate frescoes throughout the hotel are stunning. A genuinely boutique hotel experience in central Jaipur. Staff was cooperative and food was fresh. Fort view from rooftop is breathtaking.,English
802,Amit Kumar,5,World-class hospitality ka matlab yahan actually samajh aaya. Staff cooperative tha bina kisi pretense ke. Rooms spacious aur neat the. Rooftop restaurant pe fort view ke saath khana kha ke maza aa gaya Highly recommend karta hoon.,Hinglish
803,Sneha Gupta,5,The rooftop dining experience here is unlike anything else in Jaipur. Food is fresh and made on order. Heritage feel of the property combined with fort view creates a magical atmosphere One of the best stays I have had in Jaipur.,English
804,Vikram Mehta,5,"Abhi abhi checkout kiya aur cooperative staff, spacious rooms aur rooftop fort view. Is combination ke liye Jaipur mein yahan se better option milna mushkil hai. Heritage feel genuine hai aur value for money bilkul sahi hai.",Hinglish
805,Anjali Verma,5,Returned here after a year and very friendly management who personally checked on our comfort. The rooms were well-furnished and spacious. Rooftop restaurant served delicious vegetarian food with a fort view. 5 stars.,English
806,Rajesh Patel,5,"Is hotel mein sab kuch mili aur yeh sab ek reasonable price pe. Heritage atmosphere, cooperative staff, fresh food aur central location. Rooftop fort view toh bonus mein mila Bilkul worth it tha.",Hinglish
807,Pooja Yadav,5,Pichle hafte ruke the aur jaipur trip mein is heritage hotel ne sab kuch acha kar diya. Rajasthani frescoes genuinely beautiful the. Rooms neat aur comfortable the. Staff cooperative tha. Rooftop fort view was the best part Definitely wapas aaunga family ke saath.,Hinglish
808,Suresh Joshi,5,Jaipur trip pe the aur is hotel ki heritage feel aur rooftop fort view combination bahut unique hai. Rooms spacious aur well-furnished the. Staff cooperative tha throughout. Location convenient tha. Overall bahut achha experience.,Hinglish
809,Kavita Agarwal,5,"Room was clean, spacious and well-ventilated. Loved the intricate Rajasthani design elements in the interiors. Staff came to clean every morning without being asked. Very satisfied Sach mein bahut satisfy kiya is hotel ne.",Hinglish
810,Mohit Choudhary,5,Do raat ruke the aur is hotel mein Rajasthani culture ki jhalak har jagah dikh rahi thi. Intricate frescoes stunning the. Staff friendly aur humble tha. Rooftop pe fort view ke saath khana khaana memorable experience tha Sach mein bahut satisfy kiya is hotel ne.,Hinglish
811,Deepika Saxena,5,"Visited for our anniversary and rooms here are spacious, airy and very well-furnished. The cleanliness was impeccable throughout the stay. Modern amenities worked perfectly. Great value for money in Jaipur.",English
812,Arjun Tiwari,5,"Anniversary pe aaye the aur very comfortable stay. Rooms were neat and clean with a tasteful Rajasthani touch in the decor. AC worked well, hot water was available and the bed was very comfortable. No complaints Definitely wapas aaunga family ke saath.",Hinglish
813,Ritu Pandey,5,"Jaipur ki trip mein is boutique hotel ne experience bilkul alag bana diya. Heritage feel genuine hai, fakki nahi. Tastefully decorated interiors ne bohot impress kiya. Food bhi lajawaab tha Jaipur trip incomplete hoti agar yahan na ruke hote.",Hinglish
814,Manish Dubey,5,Family ke saath aaye the aur a heritage hotel that truly lives up to its billing. Rajasthani culture reflected everywhere. Staff was friendly and attentive. Rooftop fort view is the showstopper. Excellent value Jaipur mein best stay rahi yeh.,Hinglish
815,Sunita Mishra,5,Rooftop restaurant se fort view ka scene simply stunning hai. Khana bhi order pe fresh banta hai. Vegetarian options bahut saare hain. Staff attentive tha. Rooms spacious aur neat the. Wapas aana chahta hoon Jaipur trip incomplete hoti agar yahan na ruke hote.,Hinglish
816,Nikhil Bhatia,5,"Jaipur trip pe the aur thoroughly satisfied with this heritage hotel stay. Authentic Rajasthani decor, cooperative staff and fresh vegetarian food. Location near Sindhi Camp is very convenient. Will return.",Hinglish
817,Meera Kapoor,5,Teen raat ruke aur the detail in the Rajasthani frescoes here is remarkable. Hotel is tastefully decorated without being overdone. Staff was world-class in service. Rooftop fort view is simply the best 5 star dene ki mann kar raha hai.,Hinglish
818,Rohit Nair,5,Abhi abhi checkout kiya aur the room was bigger than I expected for this price range. Well-furnished with modern amenities and Rajasthani decor elements. Staff was cooperative. Overall a very satisfying experience.,Hinglish
819,Shalini Reddy,5,Teen raat ruke aur central location pe hona is hotel ki sabse badi strength hai. Heart of the city mein hone ke saath heritage feel bhi genuine hai. Staff ke saath experience top class tha. Must stay Sach mein bahut satisfy kiya is hotel ne.,Hinglish
820,Gaurav Jain,5,Stayed during anniversary and the romantic garden area and rooftop fort view made it very special. Staff was attentive without being intrusive. Rooms were comfortable and tastefully decorated Exceeded all my expectations.,English
821,Nisha Srivastava,5,Pehli baar aaye the aur yaar is hotel ka USP rooftop restaurant hai bilkul. Fort view ke saath fresh vegetarian khana aur attentive staff. Rajasthani decor bonus mein. Central location pe hone se travel easy raha. Recommend karunga.,Hinglish
822,Ashish Malhotra,5,The unique Rajasthani style of this boutique hotel is what makes it special. Spacious rooms with modern amenities. Cooperative staff throughout. Rooftop restaurant with fort view was unforgettable Dil khush kar diya.,English
823,Tanvi Shah,5,Stayed for three nights and the hotel staff is genuinely humble and welcoming. Made us feel at home from check-in to checkout. Location in heart of the city is perfect for exploring Jaipur. Loved the stay.,English
824,Pankaj Rastogi,5,This hotel strikes the perfect balance between heritage character and contemporary comfort. Staff was attentive throughout. Rooftop fort view is stunning. Central location is very convenient Really impressed with the overall experience.,English
825,Divya Bhatt,5,Yahan ki rooftop dining simply unmissable hai. Fort view ke saath fresh vegetarian khana aur attentive staff. Hotel ka heritage character genuinely beautiful hai. Will visit again with family Jaipur mein best stay rahi yeh.,Hinglish
826,Saurabh Trivedi,5,Airy aur spacious room mila jisme sab kuch theek tha. Unique style tha decor mein. Staff attentive tha throughout the stay. Rooftop restaurant ka experience toh bonus mein mila aur woh outstanding tha 5 star dene ki mann kar raha hai.,Hinglish
827,Rekha Chauhan,5,Is jagah ka atmosphere bahut peaceful aur positive tha. Rajasthani culture ka touch authentic tha. Staff friendly aur helpful tha. Rooftop restaurant se fort view ne trip ka maza aur bada diya Yahan se better hotel Jaipur mein milna mushkil hai.,Hinglish
828,Hemant Solanki,5,"Brought my team here and came for a weekend and ended up wishing I had booked more nights. Heritage boutique feel, cooperative staff and rooftop fort view. Vegetarian food was fresh and plentiful. Great stay.",English
829,Anita Thakur,5,Do raat ruke the aur rajasthani culture ka authentic feel yahan milta hai. Intricate frescoes aur tasteful decor. Staff ne world-class hospitality di. Rooftop restaurant pe fort view was simply magical Yahan se better hotel Jaipur mein milna mushkil hai.,Hinglish
830,Vivek Bansal,5,"Pichle hafte ruke the aur honestly expected achha tha but experience usse bhi zyada achha raha. Heritage atmosphere genuine tha, staff cooperative tha aur rooftop restaurant outstanding tha. Value for money excellent Dil khush kar diya.",Hinglish
831,Swati Katiyar,5,Visited recently and the combination of heritage boutique hotel charm and modern amenities is done perfectly here. Staff hospitality is world-class. Rooftop fort view is the USP. Highly recommend for Jaipur visits Would book again in a heartbeat.,English
832,Aakash Gupta,5,Pichle hafte ruke the aur checked into a well-furnished room that had all the essentials. The decor had a tasteful Rajasthani heritage feel without being overdone. Comfortable stay at a very reasonable price point.,Hinglish
